{
  "actor": "tool",
  "id": "evt_01J00000000000000000000023",
  "labels": {
    "residency": "global-ok",
    "sensitivity": "internal"
  },
  "payload": {
    "claim": "Fairy uses event logs.",
    "grade": "official",
    "retrieved_at": "2026-07-02T10:00:00.000Z",
    "source": {
      "snapshot_ref": "snap_abc",
      "span": {
        "end": 42,
        "start": 0
      },
      "title": "OpenFairy MemoryStore Notes",
      "url": "https://docs.openfairy.test/research/memory-store"
    }
  },
  "provenance": "web:docs.openfairy.test",
  "sid": "ses_01J00000000000000000000000",
  "ts": "2026-07-02T10:00:00.000Z",
  "turn": 1,
  "type": "citation.recorded",
  "v": 1
}
